{
  "schema_version": "v1",
  "response_type": "procedure_catalog_page",
  "request_id": "99999999-9999-4999-8999-999999999999",
  "tenant_id": "11111111-1111-4111-8111-111111111111",
  "items": [
    {
      "procedure_id": "56565656-5656-4565-8565-565656565656",
      "procedure_key": "water.community",
      "title": "Agua potable comunitaria",
      "jurisdiction": "Municipio de La Antigua Guatemala, Sacatepequez, Guatemala",
      "latest_version_number": 3,
      "latest_lifecycle_status": "approved",
      "approved_workflow_version_id": "67676767-6767-4676-8676-676767676767",
      "approved_version_number": 3,
      "approval_state": "approved",
      "created_at": "2026-07-20T10:00:00.000Z",
      "updated_at": "2026-07-21T10:00:00.000Z"
    }
  ],
  "next_cursor": null,
  "provenance": {
    "source_product": "la_muni_rag",
    "generated_by": "system",
    "created_at": "2026-07-21T23:00:00.000Z",
    "source_refs": [
      "56565656-5656-4565-8565-565656565656"
    ],
    "credential_id": "66666666-6666-4666-8666-666666666666",
    "audit_id": "abababab-abab-4bab-8bab-abababababab"
  }
}
